{
  "mention_id": "UgxA1b2C3#2#BATTERY",
  "comment_id": "UgxA1b2C3",
  "clause_idx": 2,
  "clause_text": "pin thì tụt nhanh quá",
  "source": "youtube",
  "video_id": "aB3dE5fG7hI",
  "video_model": "s23u",
  "target_model": "s23u",
  "aspect": "BATTERY",
  "sentiment": "neg",
  "confidence": 0.87,
  "is_owner": true,
  "defect_type": "BATTERY_DRAIN",
  "compare_with": null,
  "compare_winner": null,
  "published_at": "2023-02-10T03:15:00Z",
  "days_since_launch": 8,
  "label_source": "model",
  "model_version": "aspect-lr-v1",
  "schema_version": 1
}
